{
  "id": "seq_invoice_number",
  "startValue": 1,
  "increment": 1,
  "minValue": 1,
  "maxValue": 99999999,
  "cycle": false,
  "cache": 10,
  "usedBy": [
    { "tableId": "invoices", "columnName": "invoice_number" }
  ],
  "conventionRef": "@conv.numbering.invoiceNumber",
  "description": "請求書番号採番シーケンス (INV-YYYY-NNNN 形式)。invoices テーブルの BEFORE INSERT トリガー (trg-inv-number-gen) で nextval('seq_invoice_number') を呼び出す",
  "createdAt": "2026-04-24T00:00:00.000Z",
  "updatedAt": "2026-04-24T00:00:00.000Z"
}
